timestamp	experiment_id	hypothesis	changed_files	artifact_inputs	method_category	status	train_total_return	train_sharpe	val_total_return	val_sharpe	oos_total_return	oos_sharpe	memory_evidence_path	notes	source_type	source_run_id	source_artifact_path	crash_kind
2026-03-17T13:44:21.177866+00:00	portfolio::autonomous_session_gated_residual_basket_reversion_5m_anchor_opt	Round-2 shortlist item: Autonomous session-gated residual basket reversion 5m challenger.	[]	"[""/home/hoky/Quants-agent/LuminaQuant/var/reports/exact_window_backtests/autonomous_round2_session_contagion_5m_20260317T133033Z/5m/exact_window_candidate_details_latest.json"", ""/home/hoky/Quants-agent/LuminaQuant/var/reports/exact_window_backtests/autonomous_round2_session_contagion_5m_20260317T133033Z/5m/exact_window_suite_summary_latest.json"", ""/home/hoky/Quants-agent/LuminaQuant/var/reports/exact_window_backtests/followup_status/autonomous_session_gated_residual_basket_reversion_5m_anchor_latest.json"", ""/home/hoky/Quants-agent/LuminaQuant/var/reports/exact_window_backtests/followup_status/autonomous_session_gated_residual_basket_reversion_5m_anchor_opt/portfolio_optimization_latest.json"", ""/home/hoky/Quants-agent/LuminaQuant/var/reports/exact_window_backtests/followup_status/autonomous_session_gated_residual_basket_reversion_5m_comparison_latest.json"", ""/home/hoky/Quants-agent/LuminaQuant/var/reports/exact_window_backtests/followup_status/autonomous_session_gated_residual_basket_reversion_5m_decision_latest.json"", ""/home/hoky/Quants-agent/LuminaQuant/var/reports/exact_window_backtests/followup_status/autonomous_session_gated_residual_basket_reversion_5m_probe_latest.json""]"	portfolio	discard	-0.0294720770501	-0.444546450721	0.0233427544418	5.49168031388	0.0317283905045	2.84543847518	/home/hoky/Quants-agent/LuminaQuant/var/reports/exact_window_backtests/autonomous_round2_session_contagion_5m_20260317T133033Z/5m/exact_window_memory_evidence_latest.json	Round-2 item 3 improved validation quality versus earlier residual basket work and reduced anchored drawdown below the incumbent, but the selected probe still turned negative on locked OOS and the anchored challenger remained below the incumbent on total return and Sharpe. | peak_rss_mib=2831.934 | next_action=continue to round-2 item 4 or 5; session-gated residual basket did not clear promotion	autonomous_manual	autonomous_round2_session_contagion_5m_20260317T133033Z	/home/hoky/Quants-agent/LuminaQuant/var/reports/exact_window_backtests/followup_status/autonomous_session_gated_residual_basket_reversion_5m_anchor_opt/portfolio_optimization_latest.json	
2026-03-17T13:44:21.328121+00:00	portfolio::autonomous_cross_asset_liquidation_contagion_fade_5m_anchor_opt	Round-2 shortlist item: Autonomous cross-asset liquidation contagion fade 5m challenger.	[]	"[""/home/hoky/Quants-agent/LuminaQuant/var/reports/exact_window_backtests/autonomous_round2_session_contagion_5m_20260317T133033Z/5m/exact_window_candidate_details_latest.json"", ""/home/hoky/Quants-agent/LuminaQuant/var/reports/exact_window_backtests/autonomous_round2_session_contagion_5m_20260317T133033Z/5m/exact_window_suite_summary_latest.json"", ""/home/hoky/Quants-agent/LuminaQuant/var/reports/exact_window_backtests/followup_status/autonomous_cross_asset_liquidation_contagion_fade_5m_anchor_latest.json"", ""/home/hoky/Quants-agent/LuminaQuant/var/reports/exact_window_backtests/followup_status/autonomous_cross_asset_liquidation_contagion_fade_5m_anchor_opt/portfolio_optimization_latest.json"", ""/home/hoky/Quants-agent/LuminaQuant/var/reports/exact_window_backtests/followup_status/autonomous_cross_asset_liquidation_contagion_fade_5m_comparison_latest.json"", ""/home/hoky/Quants-agent/LuminaQuant/var/reports/exact_window_backtests/followup_status/autonomous_cross_asset_liquidation_contagion_fade_5m_decision_latest.json"", ""/home/hoky/Quants-agent/LuminaQuant/var/reports/exact_window_backtests/followup_status/autonomous_cross_asset_liquidation_contagion_fade_5m_probe_latest.json""]"	portfolio	discard	0.00870357546452	0.139808988031	0.0254805616159	3.72976013307	0.0407425442929	2.68322219064	/home/hoky/Quants-agent/LuminaQuant/var/reports/exact_window_backtests/autonomous_round2_session_contagion_5m_20260317T133033Z/5m/exact_window_memory_evidence_latest.json	Round-2 item 4 failed at the probe stage: both contagion variants showed zero participation on validation and locked OOS, so the anchored challenger only diluted the incumbent and remained below it on the locked-OOS comparison. | peak_rss_mib=2831.934 | next_action=continue to the final round-2 item; this contagion family needs a stronger event definition	autonomous_manual	autonomous_round2_session_contagion_5m_20260317T133033Z	/home/hoky/Quants-agent/LuminaQuant/var/reports/exact_window_backtests/followup_status/autonomous_cross_asset_liquidation_contagion_fade_5m_anchor_opt/portfolio_optimization_latest.json	
2026-03-17T13:44:21.462513+00:00	portfolio::autonomous_multi_horizon_trend_exhaustion_fade_30m_anchor_opt	Round-2 shortlist item: Autonomous multi-horizon trend exhaustion fade 30m challenger.	[]	"[""/home/hoky/Quants-agent/LuminaQuant/var/reports/exact_window_backtests/autonomous_round2_trend_exhaustion_30m_20260317T133659Z/30m/exact_window_candidate_details_latest.json"", ""/home/hoky/Quants-agent/LuminaQuant/var/reports/exact_window_backtests/autonomous_round2_trend_exhaustion_30m_20260317T133659Z/30m/exact_window_suite_summary_latest.json"", ""/home/hoky/Quants-agent/LuminaQuant/var/reports/exact_window_backtests/followup_status/autonomous_multi_horizon_trend_exhaustion_fade_30m_anchor_latest.json"", ""/home/hoky/Quants-agent/LuminaQuant/var/reports/exact_window_backtests/followup_status/autonomous_multi_horizon_trend_exhaustion_fade_30m_anchor_opt/portfolio_optimization_latest.json"", ""/home/hoky/Quants-agent/LuminaQuant/var/reports/exact_window_backtests/followup_status/autonomous_multi_horizon_trend_exhaustion_fade_30m_comparison_latest.json"", ""/home/hoky/Quants-agent/LuminaQuant/var/reports/exact_window_backtests/followup_status/autonomous_multi_horizon_trend_exhaustion_fade_30m_decision_latest.json"", ""/home/hoky/Quants-agent/LuminaQuant/var/reports/exact_window_backtests/followup_status/autonomous_multi_horizon_trend_exhaustion_fade_30m_probe_latest.json""]"	portfolio	discard	0.0126583713723	0.23237505478	0.0194021921344	4.34840006449	0.034505411033	3.10909230784	/home/hoky/Quants-agent/LuminaQuant/var/reports/exact_window_backtests/autonomous_round2_trend_exhaustion_30m_20260317T133659Z/30m/exact_window_memory_evidence_latest.json	Round-2 item 5 produced a small positive probe on locked OOS and slightly improved anchored drawdown, but validation stayed negative and the anchored challenger still lagged the incumbent on return and Sharpe. | peak_rss_mib=3552.691 | next_action=round-2 shortlist items 1-5 are now exhausted; wait for the deferred retune window or generate round-3 ideas	autonomous_manual	autonomous_round2_trend_exhaustion_30m_20260317T133659Z	/home/hoky/Quants-agent/LuminaQuant/var/reports/exact_window_backtests/followup_status/autonomous_multi_horizon_trend_exhaustion_fade_30m_anchor_opt/portfolio_optimization_latest.json	
