timestamp	experiment_id	hypothesis	changed_files	artifact_inputs	method_category	status	train_total_return	train_sharpe	val_total_return	val_sharpe	oos_total_return	oos_sharpe	memory_evidence_path	notes	source_type	source_run_id	source_artifact_path	crash_kind
2026-03-17T11:04:50.316725+00:00	portfolio::autonomous_sector_dispersion_reversion_30m_anchor_opt	New-hypothesis refresh: sector-dispersion-reversion 30m anchored against the current incumbent.	[]	"[""/home/hoky/Quants-agent/LuminaQuant/var/reports/exact_window_backtests/autonomous_sector_dispersion_30m_20260317T105432Z/30m/exact_window_candidate_details_latest.json"", ""/home/hoky/Quants-agent/LuminaQuant/var/reports/exact_window_backtests/autonomous_sector_dispersion_30m_20260317T105432Z/30m/exact_window_suite_summary_latest.json"", ""/home/hoky/Quants-agent/LuminaQuant/var/reports/exact_window_backtests/followup_status/autonomous_sector_dispersion_reversion_30m_anchor_latest.json"", ""/home/hoky/Quants-agent/LuminaQuant/var/reports/exact_window_backtests/followup_status/autonomous_sector_dispersion_reversion_30m_anchor_opt/portfolio_optimization_latest.json"", ""/home/hoky/Quants-agent/LuminaQuant/var/reports/exact_window_backtests/followup_status/autonomous_sector_dispersion_reversion_30m_comparison_latest.json"", ""/home/hoky/Quants-agent/LuminaQuant/var/reports/exact_window_backtests/followup_status/autonomous_sector_dispersion_reversion_30m_decision_latest.json"", ""/home/hoky/Quants-agent/LuminaQuant/var/reports/exact_window_backtests/followup_status/autonomous_sector_dispersion_reversion_30m_probe_latest.json""]"	portfolio	discard	-0.0395105791228	-0.575244412688	0.0373239403217	6.32337373692	0.0189517732876	1.56483113644	/home/hoky/Quants-agent/LuminaQuant/var/reports/exact_window_backtests/autonomous_sector_dispersion_30m_20260317T105432Z/30m/exact_window_memory_evidence_latest.json	Sector-dispersion 30m added eight bounded crypto-pair candidates, but the best validation-ranked probe (pair_spread_30m_sector_btcusdt_trxusdt_2.0_0.50) still flipped to negative locked-OOS performance (return -5.2645%, Sharpe -4.848). The anchored four-sleeve challenger then materially trailed the incumbent on locked-OOS return, Sharpe, and max drawdown. | peak_rss_mib=3541.164 | next_action=advance to single-asset-zscore-reversion 15m next; the 30m mean-reversion rows piggybacked on this run and were already negative on validation and locked OOS	autonomous_manual	autonomous_sector_dispersion_30m_20260317T105432Z	/home/hoky/Quants-agent/LuminaQuant/var/reports/exact_window_backtests/followup_status/autonomous_sector_dispersion_reversion_30m_anchor_opt/portfolio_optimization_latest.json	
2026-03-17T11:27:52.357344+00:00	portfolio::autonomous_single_asset_zscore_reversion_15m_anchor_opt	New-hypothesis refresh: single-asset-zscore-reversion 15m anchored against the current incumbent.	[]	"[""/home/hoky/Quants-agent/LuminaQuant/var/reports/exact_window_backtests/autonomous_intraday_15m_20260315T032440Z/15m/exact_window_candidate_details_latest.json"", ""/home/hoky/Quants-agent/LuminaQuant/var/reports/exact_window_backtests/autonomous_intraday_15m_20260315T032440Z/15m/exact_window_suite_summary_latest.json"", ""/home/hoky/Quants-agent/LuminaQuant/var/reports/exact_window_backtests/followup_status/autonomous_single_asset_zscore_reversion_15m_anchor_latest.json"", ""/home/hoky/Quants-agent/LuminaQuant/var/reports/exact_window_backtests/followup_status/autonomous_single_asset_zscore_reversion_15m_anchor_opt/portfolio_optimization_latest.json"", ""/home/hoky/Quants-agent/LuminaQuant/var/reports/exact_window_backtests/followup_status/autonomous_single_asset_zscore_reversion_15m_comparison_latest.json"", ""/home/hoky/Quants-agent/LuminaQuant/var/reports/exact_window_backtests/followup_status/autonomous_single_asset_zscore_reversion_15m_decision_latest.json"", ""/home/hoky/Quants-agent/LuminaQuant/var/reports/exact_window_backtests/followup_status/autonomous_single_asset_zscore_reversion_15m_probe_latest.json""]"	portfolio	discard	-0.111975610207	-1.66723954598	0.0114948296042	2.82718569341	0.0270047391396	2.43543752266	/home/hoky/Quants-agent/LuminaQuant/var/reports/exact_window_backtests/autonomous_intraday_15m_20260315T032440Z/15m/exact_window_memory_evidence_latest.json	Reused the March 15, 2026 15m intraday exact-window evidence instead of rerunning a duplicate heavy lane. The validation-ranked single-asset probe (mean_reversion_std_15m_balanced_ls_64_2.00) was already deeply negative on both validation (-11.9092%, Sharpe -4.208) and locked OOS (-11.8992%, Sharpe -2.510), and the anchored challenger still trailed the incumbent on return, Sharpe, and max drawdown. | peak_rss_mib=2981.020 | next_action=advance to liquidity-shock-reversion 5m next; the 15m single-asset reversion probe failed both validation and locked-OOS quality	autonomous_manual	autonomous_intraday_15m_20260315T032440Z	/home/hoky/Quants-agent/LuminaQuant/var/reports/exact_window_backtests/followup_status/autonomous_single_asset_zscore_reversion_15m_anchor_opt/portfolio_optimization_latest.json	
2026-03-17T11:27:52.575803+00:00	portfolio::autonomous_liquidity_shock_reversion_5m_anchor_opt	New-hypothesis refresh: liquidity-shock-reversion 5m anchored against the current incumbent.	[]	"[""/home/hoky/Quants-agent/LuminaQuant/var/reports/exact_window_backtests/autonomous_liquidity_shock_5m_20260317T112047Z/5m/exact_window_candidate_details_latest.json"", ""/home/hoky/Quants-agent/LuminaQuant/var/reports/exact_window_backtests/autonomous_liquidity_shock_5m_20260317T112047Z/5m/exact_window_suite_summary_latest.json"", ""/home/hoky/Quants-agent/LuminaQuant/var/reports/exact_window_backtests/followup_status/autonomous_liquidity_shock_reversion_5m_anchor_latest.json"", ""/home/hoky/Quants-agent/LuminaQuant/var/reports/exact_window_backtests/followup_status/autonomous_liquidity_shock_reversion_5m_anchor_opt/portfolio_optimization_latest.json"", ""/home/hoky/Quants-agent/LuminaQuant/var/reports/exact_window_backtests/followup_status/autonomous_liquidity_shock_reversion_5m_comparison_latest.json"", ""/home/hoky/Quants-agent/LuminaQuant/var/reports/exact_window_backtests/followup_status/autonomous_liquidity_shock_reversion_5m_decision_latest.json"", ""/home/hoky/Quants-agent/LuminaQuant/var/reports/exact_window_backtests/followup_status/autonomous_liquidity_shock_reversion_5m_probe_latest.json""]"	portfolio	discard	-0.00972841678395	-0.111407916475	0.0173714376318	4.03759710696	0.0333172092805	3.36310512542	/home/hoky/Quants-agent/LuminaQuant/var/reports/exact_window_backtests/autonomous_liquidity_shock_5m_20260317T112047Z/5m/exact_window_memory_evidence_latest.json	Fresh 5m liquidity-shock candidates were evaluated on BTC/ETH/BNB; the best validation-ranked probe (liquidity_shock_reversion_5m_thin_lo_72_0.010) stayed negative on validation and locked OOS. The anchored challenger improved max drawdown to 0.9857% from the incumbent's 1.4277%, but it still lagged on locked-OOS total return (3.3317% vs 5.7628%). | peak_rss_mib=2808.316 | next_action=advance to regime-conditioned-composite-trend 30m next; the new liquidity sleeve improved drawdown but still missed the incumbent on locked-OOS return	autonomous_manual	autonomous_liquidity_shock_5m_20260317T112047Z	/home/hoky/Quants-agent/LuminaQuant/var/reports/exact_window_backtests/followup_status/autonomous_liquidity_shock_reversion_5m_anchor_opt/portfolio_optimization_latest.json	
2026-03-17T11:27:52.772211+00:00	portfolio::autonomous_regime_conditioned_composite_trend_30m_anchor_opt	New-hypothesis refresh: regime-conditioned-composite-trend 30m anchored against the current incumbent.	[]	"[""/home/hoky/Quants-agent/LuminaQuant/var/reports/exact_window_backtests/autonomous_composite_exec_30m_20260315T1057Z/30m/exact_window_candidate_details_latest.json"", ""/home/hoky/Quants-agent/LuminaQuant/var/reports/exact_window_backtests/autonomous_composite_exec_30m_20260315T1057Z/30m/exact_window_suite_summary_latest.json"", ""/home/hoky/Quants-agent/LuminaQuant/var/reports/exact_window_backtests/followup_status/autonomous_regime_conditioned_composite_trend_30m_anchor_latest.json"", ""/home/hoky/Quants-agent/LuminaQuant/var/reports/exact_window_backtests/followup_status/autonomous_regime_conditioned_composite_trend_30m_anchor_opt/portfolio_optimization_latest.json"", ""/home/hoky/Quants-agent/LuminaQuant/var/reports/exact_window_backtests/followup_status/autonomous_regime_conditioned_composite_trend_30m_comparison_latest.json"", ""/home/hoky/Quants-agent/LuminaQuant/var/reports/exact_window_backtests/followup_status/autonomous_regime_conditioned_composite_trend_30m_decision_latest.json"", ""/home/hoky/Quants-agent/LuminaQuant/var/reports/exact_window_backtests/followup_status/autonomous_regime_conditioned_composite_trend_30m_probe_latest.json""]"	portfolio	discard	0.0440221095967	0.50840925331	0.0388429647615	5.39787114898	0.0409977082166	2.75041294692	/home/hoky/Quants-agent/LuminaQuant/var/reports/exact_window_backtests/autonomous_composite_exec_30m_20260315T1057Z/30m/exact_window_memory_evidence_latest.json	Reused the March 15, 2026 composite-trend 30m exact-window evidence. The best validation-ranked composite variant (composite_trend_stable_30m_stable_ls_core_ls_0.60_0.45_0.20_0.80) remained positive, but the anchored challenger still underperformed the incumbent on locked-OOS return, Sharpe, and drawdown, so the family did not justify replacing or diluting the existing trend sleeve. | peak_rss_mib=3219.531 | next_action=advance to topcap-rotation-relative-momentum 1h next; the 30m composite variant remained too close to the incumbent trend sleeve to overcome the locked-OOS gap	autonomous_manual	autonomous_composite_exec_30m_20260315T1057Z	/home/hoky/Quants-agent/LuminaQuant/var/reports/exact_window_backtests/followup_status/autonomous_regime_conditioned_composite_trend_30m_anchor_opt/portfolio_optimization_latest.json	
2026-03-17T11:27:52.984499+00:00	portfolio::autonomous_topcap_rotation_relative_momentum_1h_anchor_opt	New-hypothesis refresh: topcap-rotation-relative-momentum 1h anchored against the current incumbent.	[]	"[""/home/hoky/Quants-agent/LuminaQuant/var/reports/exact_window_backtests/autonomous_topcap_exec_1h_20260315T0945Z/1h/exact_window_candidate_details_latest.json"", ""/home/hoky/Quants-agent/LuminaQuant/var/reports/exact_window_backtests/autonomous_topcap_exec_1h_20260315T0945Z/1h/exact_window_suite_summary_latest.json"", ""/home/hoky/Quants-agent/LuminaQuant/var/reports/exact_window_backtests/followup_status/autonomous_topcap_rotation_relative_momentum_1h_anchor_latest.json"", ""/home/hoky/Quants-agent/LuminaQuant/var/reports/exact_window_backtests/followup_status/autonomous_topcap_rotation_relative_momentum_1h_anchor_opt/portfolio_optimization_latest.json"", ""/home/hoky/Quants-agent/LuminaQuant/var/reports/exact_window_backtests/followup_status/autonomous_topcap_rotation_relative_momentum_1h_comparison_latest.json"", ""/home/hoky/Quants-agent/LuminaQuant/var/reports/exact_window_backtests/followup_status/autonomous_topcap_rotation_relative_momentum_1h_decision_latest.json"", ""/home/hoky/Quants-agent/LuminaQuant/var/reports/exact_window_backtests/followup_status/autonomous_topcap_rotation_relative_momentum_1h_probe_latest.json""]"	portfolio	discard	-0.0172014286263	-0.131199695018	0.0278661285907	4.09846624658	0.0236497780385	1.58791761107	/home/hoky/Quants-agent/LuminaQuant/var/reports/exact_window_backtests/autonomous_topcap_exec_1h_20260315T0945Z/1h/exact_window_memory_evidence_latest.json	Reused the March 15, 2026 topcap 1h exact-window evidence. The best validation-ranked topcap rotation variant (topcap_tsmom_1h_defensive_24_6_0.020) flipped negative on locked OOS, and the anchored challenger materially trailed the incumbent on return, Sharpe, and max drawdown. | peak_rss_mib=3096.969 | next_action=all new-hypothesis refresh lanes are now exhausted without beating the incumbent; wait for the deferred 2026-03-31 XPT/XPD retune window or invent a new family	autonomous_manual	autonomous_topcap_exec_1h_20260315T0945Z	/home/hoky/Quants-agent/LuminaQuant/var/reports/exact_window_backtests/followup_status/autonomous_topcap_rotation_relative_momentum_1h_anchor_opt/portfolio_optimization_latest.json	
2026-03-17T11:46:38.054215+00:00	portfolio::autonomous_btc_beta_neutral_single_asset_zscore_15m_anchor_opt	Post-refresh shortlist item 1: BTC-beta-neutral single-asset zscore reversion 15m anchored against the current incumbent.	[]	"[""/home/hoky/Quants-agent/LuminaQuant/var/reports/exact_window_backtests/autonomous_btc_beta_neutral_zscore_15m_20260317T113800Z/15m/exact_window_candidate_details_latest.json"", ""/home/hoky/Quants-agent/LuminaQuant/var/reports/exact_window_backtests/autonomous_btc_beta_neutral_zscore_15m_20260317T113800Z/15m/exact_window_suite_summary_latest.json"", ""/home/hoky/Quants-agent/LuminaQuant/var/reports/exact_window_backtests/followup_status/autonomous_btc_beta_neutral_single_asset_zscore_15m_anchor_latest.json"", ""/home/hoky/Quants-agent/LuminaQuant/var/reports/exact_window_backtests/followup_status/autonomous_btc_beta_neutral_single_asset_zscore_15m_anchor_opt/portfolio_optimization_latest.json"", ""/home/hoky/Quants-agent/LuminaQuant/var/reports/exact_window_backtests/followup_status/autonomous_btc_beta_neutral_single_asset_zscore_15m_comparison_latest.json"", ""/home/hoky/Quants-agent/LuminaQuant/var/reports/exact_window_backtests/followup_status/autonomous_btc_beta_neutral_single_asset_zscore_15m_decision_latest.json"", ""/home/hoky/Quants-agent/LuminaQuant/var/reports/exact_window_backtests/followup_status/autonomous_btc_beta_neutral_single_asset_zscore_15m_probe_latest.json""]"	portfolio	discard	0.00593401724154	0.114385590356	0.0126411814271	2.99774681011	0.0317440099303	2.41438108001	/home/hoky/Quants-agent/LuminaQuant/var/reports/exact_window_backtests/autonomous_btc_beta_neutral_zscore_15m_20260317T113800Z/15m/exact_window_memory_evidence_latest.json	Fresh 15m exact-window evidence for BTC-beta-neutral single-asset zscore reversion still failed quickly: the best residualized probe (mean_reversion_std_15m_resid_btc_guarded_lo_96_2.40) was negative on validation (-6.8939%, Sharpe -6.202) and locked OOS (-3.9982%, Sharpe -2.604). The anchored challenger also trailed the incumbent on locked-OOS return, Sharpe, and max drawdown. | peak_rss_mib=3136.551 | next_action=move to shortlist item 2: session-transition liquidity vacuum fade 5m	autonomous_manual	autonomous_btc_beta_neutral_zscore_15m_20260317T113800Z	/home/hoky/Quants-agent/LuminaQuant/var/reports/exact_window_backtests/followup_status/autonomous_btc_beta_neutral_single_asset_zscore_15m_anchor_opt/portfolio_optimization_latest.json	
2026-03-17T12:22:47.409026+00:00	portfolio::autonomous_session_liquidity_vacuum_fade_5m_anchor_opt	Post-refresh shortlist item: Autonomous session-transition liquidity vacuum fade 5m challenger.	[]	"[""/home/hoky/Quants-agent/LuminaQuant/var/reports/exact_window_backtests/autonomous_session_liquidity_vacuum_5m_20260317T120018Z/5m/exact_window_candidate_details_latest.json"", ""/home/hoky/Quants-agent/LuminaQuant/var/reports/exact_window_backtests/autonomous_session_liquidity_vacuum_5m_20260317T120018Z/5m/exact_window_suite_summary_latest.json"", ""/home/hoky/Quants-agent/LuminaQuant/var/reports/exact_window_backtests/followup_status/autonomous_session_liquidity_vacuum_fade_5m_anchor_latest.json"", ""/home/hoky/Quants-agent/LuminaQuant/var/reports/exact_window_backtests/followup_status/autonomous_session_liquidity_vacuum_fade_5m_anchor_opt/portfolio_optimization_latest.json"", ""/home/hoky/Quants-agent/LuminaQuant/var/reports/exact_window_backtests/followup_status/autonomous_session_liquidity_vacuum_fade_5m_comparison_latest.json"", ""/home/hoky/Quants-agent/LuminaQuant/var/reports/exact_window_backtests/followup_status/autonomous_session_liquidity_vacuum_fade_5m_decision_latest.json"", ""/home/hoky/Quants-agent/LuminaQuant/var/reports/exact_window_backtests/followup_status/autonomous_session_liquidity_vacuum_fade_5m_probe_latest.json""]"	portfolio	discard	0.00492174318457	0.109671817104	0.0204027598482	4.60996503088	0.0299381132772	2.67480489396	/home/hoky/Quants-agent/LuminaQuant/var/reports/exact_window_backtests/autonomous_session_liquidity_vacuum_5m_20260317T120018Z/5m/exact_window_memory_evidence_latest.json	Fresh 5m exact-window evidence for session-transition liquidity vacuum fade produced a mildly positive validation probe, but the selected sleeve still flipped negative on locked OOS and the anchored challenger remained below the incumbent on return, Sharpe, and max drawdown. | peak_rss_mib=2850.824 | next_action=continue through the remaining shortlist items; this session-transition idea did not clear the incumbent	autonomous_manual	autonomous_session_liquidity_vacuum_5m_20260317T120018Z	/home/hoky/Quants-agent/LuminaQuant/var/reports/exact_window_backtests/followup_status/autonomous_session_liquidity_vacuum_fade_5m_anchor_opt/portfolio_optimization_latest.json	
2026-03-17T12:22:47.826884+00:00	portfolio::autonomous_residual_basket_reversion_15m_anchor_opt	Post-refresh shortlist item: Autonomous residual basket reversion 15m challenger.	[]	"[""/home/hoky/Quants-agent/LuminaQuant/var/reports/exact_window_backtests/autonomous_volvol_residual_15m_20260317T120508Z/15m/exact_window_candidate_details_latest.json"", ""/home/hoky/Quants-agent/LuminaQuant/var/reports/exact_window_backtests/autonomous_volvol_residual_15m_20260317T120508Z/15m/exact_window_suite_summary_latest.json"", ""/home/hoky/Quants-agent/LuminaQuant/var/reports/exact_window_backtests/followup_status/autonomous_residual_basket_reversion_15m_anchor_latest.json"", ""/home/hoky/Quants-agent/LuminaQuant/var/reports/exact_window_backtests/followup_status/autonomous_residual_basket_reversion_15m_anchor_opt/portfolio_optimization_latest.json"", ""/home/hoky/Quants-agent/LuminaQuant/var/reports/exact_window_backtests/followup_status/autonomous_residual_basket_reversion_15m_comparison_latest.json"", ""/home/hoky/Quants-agent/LuminaQuant/var/reports/exact_window_backtests/followup_status/autonomous_residual_basket_reversion_15m_decision_latest.json"", ""/home/hoky/Quants-agent/LuminaQuant/var/reports/exact_window_backtests/followup_status/autonomous_residual_basket_reversion_15m_probe_latest.json""]"	portfolio	discard	-0.0807308417835	-1.33452305868	0.0124438970265	3.0828538513	0.0324482432657	3.11275442428	/home/hoky/Quants-agent/LuminaQuant/var/reports/exact_window_backtests/autonomous_volvol_residual_15m_20260317T120508Z/15m/exact_window_memory_evidence_latest.json	Fresh 15m residual-basket evidence improved drawdown materially in the anchored portfolio, but both probe variants were still negative individually and the anchored challenger remained below the incumbent on locked-OOS return and Sharpe. | peak_rss_mib=3139.344 | next_action=continue through the remaining shortlist items; residual basket reversion still lacks enough upside over the incumbent	autonomous_manual	autonomous_volvol_residual_15m_20260317T120508Z	/home/hoky/Quants-agent/LuminaQuant/var/reports/exact_window_backtests/followup_status/autonomous_residual_basket_reversion_15m_anchor_opt/portfolio_optimization_latest.json	
2026-03-17T12:22:48.013532+00:00	portfolio::autonomous_breadth_thrust_failure_reversal_30m_anchor_opt	Post-refresh shortlist item: Autonomous breadth-thrust failure reversal 30m challenger.	[]	"[""/home/hoky/Quants-agent/LuminaQuant/var/reports/exact_window_backtests/autonomous_breadth_thrust_30m_20260317T121412Z/30m/exact_window_candidate_details_latest.json"", ""/home/hoky/Quants-agent/LuminaQuant/var/reports/exact_window_backtests/autonomous_breadth_thrust_30m_20260317T121412Z/30m/exact_window_suite_summary_latest.json"", ""/home/hoky/Quants-agent/LuminaQuant/var/reports/exact_window_backtests/followup_status/autonomous_breadth_thrust_failure_reversal_30m_anchor_latest.json"", ""/home/hoky/Quants-agent/LuminaQuant/var/reports/exact_window_backtests/followup_status/autonomous_breadth_thrust_failure_reversal_30m_anchor_opt/portfolio_optimization_latest.json"", ""/home/hoky/Quants-agent/LuminaQuant/var/reports/exact_window_backtests/followup_status/autonomous_breadth_thrust_failure_reversal_30m_comparison_latest.json"", ""/home/hoky/Quants-agent/LuminaQuant/var/reports/exact_window_backtests/followup_status/autonomous_breadth_thrust_failure_reversal_30m_decision_latest.json"", ""/home/hoky/Quants-agent/LuminaQuant/var/reports/exact_window_backtests/followup_status/autonomous_breadth_thrust_failure_reversal_30m_probe_latest.json""]"	portfolio	discard	0.00870357546452	0.139808988031	0.0254805616159	3.72976013307	0.0407425442929	2.68322219064	/home/hoky/Quants-agent/LuminaQuant/var/reports/exact_window_backtests/autonomous_breadth_thrust_30m_20260317T121412Z/30m/exact_window_memory_evidence_latest.json	Fresh 30m breadth-thrust failure reversal evidence showed no usable participation, and the anchored challenger simply diluted the incumbent with no locked-OOS improvement. | peak_rss_mib=3558.875 | next_action=current post-refresh shortlist items 1-5 are exhausted; wait for the deferred retune window or invent another family	autonomous_manual	autonomous_breadth_thrust_30m_20260317T121412Z	/home/hoky/Quants-agent/LuminaQuant/var/reports/exact_window_backtests/followup_status/autonomous_breadth_thrust_failure_reversal_30m_anchor_opt/portfolio_optimization_latest.json	
